{
  "$schema": "../../schemas/zpak.schema.json",
  "name": "fishing-bag-mechanic",
  "feature_id": "F-157",
  "version": "0.1.0",
  "description": "F-157: Fishing poles work from bags, lures become consumable buffs",
  "author": "Zeppelin Team",
  "type": "native",
  "contents": {
    "sql": [
      "sql/*.sql"
    ],
    "dbc": [
      "dbc/*.sql"
    ]
  },
  "enabled": true,
  "priority": 100
}
