{
  "$schema": "../../schemas/zpak.schema.json",
  "name": "mod-reagent-bank-account",
  "version": "0.1.0",
  "description": "Account-wide reagent bank storage",
  "author": "Zeppelin Team",
  "type": "acore-extension",
  "acore": {
    "module": "mod-reagent-bank-account",
    "source": "https://github.com/SoulSeekkor/mod-reagent-bank-account.git",
    "branch": "master",
    "patch_mode": "single"
  },
  "contents": {
    "patches": ["patches/*.patch"]
  },
  "enabled": true,
  "priority": 100
}
