{
  "$schema": "../../schemas/zpak.schema.json",
  "name": "sunlight",
  "feature_id": "F-145",
  "version": "0.1.0",
  "description": "Sunlight - enhanced lighting and sunlight effects",
  "author": "Zeppelin Team",
  "type": "mpq",
  "client_patch": "PATCH-S",
  "contents": {
    "mpq": ["mpq/**/*"]
  },
  "enabled": true,
  "priority": 100
}
