{
  "$schema": "../../schemas/zpak.schema.json",
  "name": "PACKAGE_NAME",
  "version": "0.1.0",
  "description": "PACKAGE_DESCRIPTION",
  "author": "Zeppelin Team",

  "type": "mpq",

  "contents": {
    "mpq": {
      "assets": ["assets/"],
      "output": "PATCH-X.MPQ"
    }
  },

  "enabled": true,
  "priority": 200
}
