{
  "$schema": "../../schemas/zpak.schema.json",
  "name": "accountbound",
  "version": "0.1.0",
  "description": "Account-bound item sharing between characters",
  "author": "Zeppelin Team",
  "type": "acore-extension",
  "acore": {
    "module": "mod-accountbound",
    "source": "https://github.com/azerothcore/mod-accountbound.git",
    "branch": "master",
    "patch_mode": "single"
  },
  "contents": {
    "patches": ["patches/*.patch"]
  },
  "enabled": true,
  "priority": 100
}
