{
  "$schema": "../../schemas/zpak.schema.json",
  "name": "multi-spec",
  "version": "1.0.0",
  "description": "Multiple talent specializations per character",
  "author": "ZepplinCore-Development",
  "type": "acore-extension",
  "acore": {
    "module": "multiple_specializations",
    "source": "https://github.com/ZepplinCore-Development/multiple_specializations.git",
    "branch": "master",
    "patch_mode": "single"
  },
  "contents": {
    "patches": ["patches/*.patch"]
  },
  "enabled": true,
  "priority": 100
}
